,Unnamed: 0,labels_text,tweet
631,31,__label__1,I wish I did in Korea
632,32,__label__1,Do not get sore on your throat. Do not get sick. Go to your quarters. Get a lot of warm water. Ginger tea.
633,33,__label__1,"I want you to knock me out and knock me off, Ringer."
634,34,__label__1,I am choking and I feel sick
635,35,__label__1,"Joy ㅠ ㅠ I have a little rest It 's a lot late, but do not overdo it I was really cold or did I feel badly hurt?"
636,36,__label__1,I do not want to go to work. I do not really like it.
637,37,__label__1,I did not wash my sister.I love you when I go home.I love you chicken sagar.Please open the door.I'm sorry.I will do the laundry tomorrow.I'll buy pizza.
638,38,__label__1,Do not forget that sleep is not coming right now.
639,39,__label__1,Why can not I contact you?
640,40,__label__1,Oh lol I thought l was staying with the girl.
641,41,__label__1,"헙 Wait a minute, I'm too fond of you, my god. I believe in you Yuza, this is going to be released in this week. I've seen this in the future."
642,42,__label__1,"No, do not put on the model."
643,43,__label__1,Why do you always sleep uncomfortably?
644,44,__label__1,Thank you very much
645,45,__label__1,I am also in favor of these couples.
646,46,__label__1,ㅠ ㅠ
647,47,__label__1,"Oh, give me a hand."
648,48,__label__1,The night season is back.
649,49,__label__1,I really hope to see you sometime soon on your birthday.
650,50,__label__1,The world is cute even though I can breathe quietly.
651,51,__label__1,"I am so sorry that I can not see Dong-na today, but I do not know if I will be more excited next time."
652,52,__label__1,"I am really tired of today's meals, but I have not been able to feed them because of beer and it is really painful today. ㅋㅋㅋ ㅋㅋㅋ ㅋㅋㅋ ㅋㅋㅋ"
653,53,__label__1,I do not want to have to suck all of them except for sticking to a rat.
654,54,__label__1,"No, this is when we mute this much."
655,55,__label__1,Today is the end of the last day of namjongjong Get out of the last day of wake up from the gate
656,56,__label__1,"I'm looking for a green tee, and I'm getting caffeinated. I'm crazy. It's crazy. I look at the ceiling for almost four hours today."
657,57,__label__1,Do not do this.
658,58,__label__1,Miss Korea
659,59,__label__1,Seoul Tower
660,60,__label__1,"The more I hear them, the more I can hear these wonderful songs in a short time. Thank you."
661,61,__label__1,Black Black Black
662,62,__label__1,It's a good idea.
663,63,__label__1,I'm sorry.
664,64,__label__1,"Ji-min, you are really"
665,65,__label__1,"Never Ending, Never Ending Infinite I Love"
666,66,__label__1,"Daeon brother is okay. You have a lot of mammies. It's okay. You can think about it, but you can not fall off."
667,67,__label__1,I'm sorry I forgot to hit the arm.
668,68,__label__1,It's dark.
669,69,__label__1,Heng trains
670,70,__label__1,"I've had a lot of fun and I've had a lot of fun and I'm so fond of it, I guess I'll be able to get rid of it in the past. I will not wait till next year. ㅠㅠ ㅠㅠ"
671,71,__label__1,"Dad, do not do this. I do not have time to upload a busy photo."
672,72,__label__1,I was on a waiting ride but my cellphone was kicked off and then I turned it off. ㅜ ㅜ ㅜ ㅜ ㅜ ㅜ ㅜ ㅠ ㅠ ㅠ ㅠ ㅠ ㅠ ㅠ ㅠ ㅠ ㅠ ㅠ ㅠ ㅠ ㅠ ㅠ ㅠ ㅠ ㅠ ㅠ ㅠ ㅠ ㅠ ㅠ ㅠ ㅠ ㅠ ㅠ ㅠ ㅠ ㅠ ㅠ ㅠ ㅠ ㅠ ㅠ ㅠ ㅠ ㅠ ㅠ ㅠ ㅠ ㅠ ㅠ ㅠ ㅠ ㅠ ㅠ ㅠ ㅠ
673,73,__label__1,It's black.
674,74,__label__1,I think the logo on the picture is missing.
675,75,__label__1,Young Forever ㅠ ㅠ Young Forever is my tear button
676,76,__label__1,It's getting worse.
677,77,__label__1,I've got a rhythm.
678,78,__label__1,I'm sorry I love you
679,79,__label__1,Black Suvin I'm looking forward to it ㅎ ㅎ Beautiful Princess Suvin's real chan uck chan ㅜ ㅜ Alla 븅
680,80,__label__1,I'd like to meet you at the signing ceremony. I want to meet you.
681,81,__label__1,Sewing Report
682,82,__label__1,I am looking forward to seeing you happily at Tamara from day to day. I am going to sleep and go to sleep. ㅠ ㅠ ㅠ ㅠ ㅠ ㅠ ㅠ ㅠ ㅠ ㅠ ㅠ ㅠ ㅠ ㅠ ㅠ
683,83,__label__1,I miss you.
684,84,__label__1,Hyun-woo loves Esol
685,85,__label__1,Non-nongon was wrong in my body.
686,86,__label__1,hate
687,87,__label__1,"If the cover is released on Friday, it will be photographed today."
688,88,__label__1,"Valentine 's Greetings, please."
689,89,__label__1,This week's just a night slave.
690,90,__label__1,"It's a cute two-handed,"
691,91,__label__1,"On the day of the month,"
692,92,__label__1,I pray for the beauty of the deceased. I do not really believe in the tears of seeing the mentees and the pictures again.
693,93,__label__1,I am envious of how fast my people are successful.
694,94,__label__1,"I saw it, and the two of us went to go."
695,95,__label__1,Bus stop in front of Yeouido Park
696,96,__label__1,A fan letter tea leaflet I want to have unequivocally letter of Hahjin ㅠ ㅠ ㅠ ㅠ ㅠ ㅠ ㅠ ㅠ ㅠ ㅠ ㅠ ㅠ ㅠ ㅠ
697,97,__label__1,The end of the line is missing.
698,98,__label__1,"I have a lot of escalators. I have a lot of dogs. I'm walking up. My legs are aching. I know I'm low in fitness, but this is too deep."
699,99,__label__1,"Whenever the performance is over, I will always welcome you with your heartfelt greetings to the fans who cheered you up. I will come back next time but I want to be with you forever. I want to stay with Winner who does not want to break up for a while."
700,100,__label__1,"I do not want to have a photo book, but I do not know why."
701,101,__label__1,I really love you
702,102,__label__1,I heard a lot of footprints.
703,103,__label__1,"Matsui and 쵱컾, but the battle homo 삘 I am also good at Wu Shiwa It is very good that Ouchima who ought to be beside him,"
704,104,__label__1,Why do I get so sleepy today? I have to study for the exam.
705,105,__label__1,Looking at the cardi report
706,106,__label__1,"It is a funny thing,"
707,107,__label__1,Monday is always tired.
708,108,__label__1,I do not have a tablet and a gold hand.
709,109,__label__1,I love you Jun-ho.
710,110,__label__1,"Song Festival Second Day Winning A long time ago, a black choker,"
711,111,__label__1,Something is running a little bit more and more.
712,112,__label__1,"My brother, my beloved brother, my beloved Ham, Seungjin, my brother, happy birthday, Chu Chu cha chuk, my brother, in this world, I will work with you in the future."
713,113,__label__1,I am very
714,114,__label__1,I was very busy on the weekend. Musical will be over soon. I am going to go to the last performance. I was busy on the weekend too. I called the teacher from Korea and made a lecture event to make a candle.
715,115,__label__1,"As soon as you get out of the car,"
716,116,__label__1,The
717,117,__label__1,I miss you
718,118,__label__1,"We should be friends, we should feel a little bit like that, we should just be friends."
719,119,__label__1,So today I want to go to my office too. But I have to go to school.
720,120,__label__1,"I am more grateful to you, my seniors. I am so happy that you give me a good name and greet you at night. I really did not wake up, but I was sleeping well. You had a warm night and got up. Hope"
721,121,__label__1,ㅠ ㅠ ㅠ ㅠ ㅠ ㅠ ㅠ ㅠ ㅠ ㅠ ㅠ ㅠ ㅠ ㅠ ㅠ ㅠ ㅠ ㅠ ㅠㅠ ㅠ ㅠ
722,122,__label__1,"I hear your tears coming out of the earphones, but why is it? ㅠ ㅠ ㅠ ㅠ ㅠ ㅠ ㅠ ㅋ ㅋ ㅋ ㅋ ㅋ ㅋ ㅋ ㅋ ㅋ ㅋ ㅋ ㅋ ㅋ ㅋ ㅋ ㅋ ㅋ ㅋ ㅋ ㅋ ㅋ ㅋ ㅋ ㅋ ㅋ ㅋ ㅋ ㅋ ㅋ ㅋ ㅋ ㅋ ㅋ ㅋ ㅋ ㅋ ㅋ ㅋ ㅋ ㅋ ㅋ Gently"
723,123,__label__1,Everybody's in school. I'm not in school. This is my graduation this week.
724,124,__label__1,I want to go to Korea
725,125,__label__1,Seventeen downtown raid incident index
726,126,__label__1,"Produced before SOMMY MNET Good, but I'm sick and woolly SOMY I'm so pretty WILD"
727,127,__label__1,"After that, I often see the icon on the right side of the strap"
728,128,__label__1,I am sick of knowing the mind.
729,129,__label__1,"ㅋㅋㅋ ㅋㅋㅋ Oh, even if it is only 5,000 won ㅠ ㅠ There are people who win a few hundred thousand won poor poor I love shoes"
730,130,__label__1,Do I have to say I'm glad that I'm wearing pants?
731,131,__label__1,Oh why and why not.
732,132,__label__1,Kang Dongwon alone Kang Dong-dong new movie Lee Chang-dong new casting confirmed Monthly crankind Source Sports Korean history Naver Entertainment Hongsik Oh thank you Fixed article How long have you waited
733,133,__label__1,"If you go there, you will be out for a while at the food corner."
734,134,__label__1,Chan-hee's eyes
735,135,__label__1,Chelore
736,136,__label__1,Seru-sama We are strong and we are black
737,137,__label__1,"Oh yeah, I know that I should be good at prizes management. I have to break back and adjust my strength well, and I will appreciate you every time I see a clean picture of a free pencil. I do not know if it is colored or not."
738,138,__label__1,It is hair color that I used to do before.
739,139,__label__1,It's hard to see on tweets.
740,140,__label__1,Daejeon Tower Minhyeon Lee Hyun-hyun's hands are so small that Minhyeon is the most prettiest in the world.
741,141,__label__1,Congratulations on your graduation.
742,142,__label__1,The back of your clothes is only for those who have been in communication.
743,143,__label__1,"I really love you. I can not express this in words. I mean, I mean, I like it very much. I am so excited to be with you and Ying. I am very tired of you and I have a lot of communication with you. I am so sad."
744,144,__label__1,It is obvious that today is my brother's side.
745,145,__label__1,This is a big reason for gel.
746,146,__label__1,"Ah, but official tweets are not why alarming"
747,147,__label__1,We love you too
748,148,__label__1,I want to see you too. I do not meet for more than a month already.
749,149,__label__1,A gift
750,150,__label__1,ㅋㅋㅋ ㅋㅋㅋ ㅋㅋㅋ ㅋㅋㅋ ㅋㅋㅋ cute
751,151,__label__1,"Kim, Han-gil, get out of the house"
752,152,__label__1,I was really happy with it. ㅠㅠ ㅠㅠㅠ I love you.
753,153,__label__1,"I have canceled the reservation because of the atmosphere of the match-up rumor, Hyundai players who showed the best game of the season."
754,154,__label__1,"I'm going to go to the old times with all of you, put down all the Buddhist priests to the Buddhist priests."
755,155,__label__1,I want to get out of bed quickly.
756,156,__label__1,I can not do it because of the cold.
757,157,__label__1,"Ji Min, I had a good stage and it was cool. I do not feel sick and rest. I go to play in France until the show. I'm listening to Young Forever from work."
758,158,__label__1,I do not have anything to do with my customs. It's just mangodong. But I made it a bit obscure for what I did in a big company.
759,159,__label__1,"I was like the same as before, but it was hard to study abroad, but it is hard to study abroad. I cried and cried,"
760,160,__label__1,You guys are sad.
761,161,__label__1,Now it's over the sky Otherwise I was so tired in Korea and today I was so busy I was able to slow down only at lunch
762,162,__label__1,I do not want to write
763,163,__label__1,"Ah, I have waited for the sale of stock,"
764,164,__label__1,"Well, what do you want me to tell you again? Oh, I used to wear some boyish casual wear. I started to wear feminine clothes. I had avoided it because it was not good for me. Now I am a high school student."
765,165,__label__1,"I always miss studying, studying hard. After studying hard, I will stick to police officers and look for my brother."
766,166,__label__1,"ㅠ ㅠ ㅠ ㅠ ㅠ ㅠ ㅠ ㅠ ㅠ ㅠ ㅠ ㅠ ㅠ ㅠ ㅠ ㅠ ㅠ ㅠ ㅠ ㅠ ㅠ ㅠ ㅠ ㅠ ㅠ ㅠ Sorry,"
767,167,__label__1,Please come back.
768,168,__label__1,I do not know how to do it. I do not know how to do it. I do not know how to do it.
769,169,__label__1,I want to see a cold-eyed father behind the hook
770,170,__label__1,I'm tired of you. Come on.
771,171,__label__1,I'm good. I'm good.
772,172,__label__1,I've been doing pretty well since the test tomorrow. My moon. What are you doing?
773,173,__label__1,It's a lot of cute pictures.
774,174,__label__1,Goji's mother's best
775,175,__label__1,"Of course, it's a day to be promoted."
776,176,__label__1,I'll see you when you're under your fingers.
777,177,__label__1,Ozland
778,178,__label__1,Do you have a good time in my house?
779,179,__label__1,I love you
780,180,__label__1,"What is your brother's chess,"
781,181,__label__1,I really love you very much.
782,182,__label__1,ㅋ ㅋㅋ ㅋ I'm dying to die
783,183,__label__1,Thank you for arriving in Korea. I will not forget. I love you. I'll meet you again.
784,184,__label__1,Black day is on the same day.
785,185,__label__1,Thank you very much.
786,186,__label__1,It's too hard for me. ㅠ ㅠ ㅠ ㅠ ㅠ ㅠ ㅇ ㅇ ㅋ ㅋ
787,187,__label__1,Walk this night and walk to the ground as you drink the dawn.
788,188,__label__1,Glass
789,189,__label__1,"No, I ruined Kagura."
790,190,__label__1,"Do not come to see me on a busy day, but I have to snore whenever I have time."
791,191,__label__1,Popular
792,192,__label__1,It's right. It's rice. Bob.
793,193,__label__1,I was so pushed.
794,194,__label__1,I love you
795,195,__label__1,"Oh, it means two."
796,196,__label__1,"In the morning,"
797,197,__label__1,The salmon is compassionate.
798,198,__label__1,Hung
799,199,__label__1,"I want to go because I am in Korea on that day, but I am alone."
800,200,__label__1,It's a pile of cotton.
801,201,__label__1,I want to see you too
802,202,__label__1,"Today I saw why I could not get up, but the alarm was set up. ㅋ ㅋ ㅋ ㅋㅋㅋ"
803,203,__label__1,I'm really out of bed
804,204,__label__1,Bon appetite
805,205,__label__1,My brother's all gone.
806,206,__label__1,"I wanted to do as much as possible, but I can not print a few pages."
807,207,__label__1,My love for my brother will never stop
808,208,__label__1,I had a lot of trouble this weekend. I will never forget my time together.
809,209,__label__1,I do not see the list that you gave me.
810,210,__label__1,Hoa new job first work
811,211,__label__1,I wonder if you want to see me write a letter to Kokka I wonder what you're doing I'm worried that you're not sick
812,212,__label__1,"I would never be a good boy for a lifetime, I just did not do anything, but I was looking for work to do now that this time is too late. Ryu Ryu Ai became a bad child"
813,213,__label__1,Do not let our pigs hurt you.
814,214,__label__1,"Well, I can not really do that. Smart cover is expensive."
815,215,__label__1,Twenty-three years old ㅠ ㅠ ㅠ ㅠ ㅠ ㅠ ㅠㅠㅠ
816,216,__label__1,I do not want to go to work on sunny Sunday.
817,217,__label__1,Gaon chart Red carpet runway
818,218,__label__1,I think it's crying.
819,219,__label__1,I want to eat giblets and I want to eat bibim noodles.
820,220,__label__1,Ludya
821,221,__label__1,ㅠ ㅠ
822,222,__label__1,Dara Sister Spring Sister
823,223,__label__1,"If I put on such a cute little thing this morning, I will cry and grow up sleeping."
824,224,__label__1,"I went to see him, and I suddenly grumbled, and in the meantime, the rehabilitation is so beautiful, lovable and cute."
825,225,__label__1,I want to tear it up too much. Why do I have to put it in front of this ambassador? Why is it so good to talk about it? I will switch the topic suddenly from here ㅋ ㅋ I obviously have a lot of trouble. I'm going to use a delusion car.
826,226,__label__1,Lee Seungcheol I watched my cries and cried Bad sunny day I'm starting to cry from daylight I'm really impressed Sunny is proud to say that if any man is going to cheer up ㅋㅋㅋ ㅋㅋㅋ
827,227,__label__1,I think it's time for you to think about what you're talking about.
828,228,__label__1,I am so nervous that I have to work for a handshake session. ㅠ ㅠ I want to talk to you soon
829,229,__label__1,I wish you a happy day One day I feel uncomfortable One day I want to be a happy day Yoon Eun Hye I love you day
830,230,__label__1,"When I sleep deeply, when I fall asleep,"
831,231,__label__1,ㅠClass
832,232,__label__1,"I also just open meme iben, angel is real."
833,233,__label__1,I want to make a preview of the final exam.
834,234,__label__1,"No, it was Marling who was going to go to bed."
835,235,__label__1,I want to see you.
836,236,__label__1,Tired child
837,237,__label__1,I want to go to see you.
838,238,__label__1,I do not have two vacations for my sister and I have to go to the energy work I received from Yongbae.
839,239,__label__1,"Oh ha ha, I have a class time. I'm happy."
840,240,__label__1,I'll give you a hundred puffy pussy after I'm done.
841,241,__label__1,"I am still hungry. I can not digest the pizza, the pasta, and the bunny with the rouled linking. I still love the pizza, but we have to go to COEX."
842,242,__label__1,ㅠ ㅠ ㅠ ㅠ ㅠ ㅠ ㅠ Liked ㅠ ㅠ ㅠ ㅠ ㅠ ㅠ ㅠ ㅠ ㅠ ㅠ ㅠ ㅠ ㅋ ㅋㅋㅋ ㅋㅋㅋ ㅋㅋㅋ ㅋㅋㅋ ㅋㅋㅋ
843,243,__label__1,"I feel bad, I heard a lot, but I could not give much credit to my new owner."
844,244,__label__1,"Good morning, Mr. Shugende."
845,245,__label__1,Twitter has been fine for a while and Tamra has not been able to refresh again.
846,246,__label__1,It's cold today.
847,247,__label__1,"I'm sitting at my desk to study for my brother, but I can not study. I have not lived in the state, but I need to get it focused. ㅜ ㅜ I have to go to see you at work."
848,248,__label__1,I want to carry milk with milk.
849,249,__label__1,I do not know what Chan is talking about.
850,250,__label__1,I do not know if I have a dad but I want to see my dad.
851,251,__label__1,Baby girl
852,252,__label__1,"Thanks to the good work, the diarrhea in the asshole became clear."
853,253,__label__1,I have to call you often. I love you.
854,254,__label__1,I do not know what to do. We are good at cooking and I need to drink a room. Lee Seung Gi Song 꿒 No Job Good song I do not understand
855,255,__label__1,"No, sir, you were on the way past me. ㅋ ㅋㅋ That's what I wanted to do. Beautiful than beautiful."
856,256,__label__1,I'm not sleeping yet. I'm sleeping. I do not sleep. I do not sleep. Eugene. I do not know.
857,257,__label__1,Incheon fan signing chanryeol water mug is also pretty cute good handsome ㅠ ㅠ why not a bucket
858,258,__label__1,"I have a stomachache in my mouth these days, and if it's hot in the upper lip, it's hot or cold, or it gets hot, it's going to get sore. Vitamin intake."
859,259,__label__1,Crazy shout.
860,260,__label__1,Non-nongon was wrong in my body.
861,261,__label__1,ㅠ ㅜ ㅠ ㅠ ㅠ ㅡ ㅠ ㅠ ㅠ ㅠ ㅠ ㅠ ㅠ ㅠ ㅠ ㅠ ㅠ ㅠ ㅠ ㅠ ㅠ ㅠ ㅠ ㅠ ㅠ ㅠ ㅠ ㅠ ㅠ ㅠ ㅠ ㅠ ㅠ ㅠ ㅠ ㅠ ㅠ ㅠ ㅠ ㅠ ㅠ ㅠ ㅠ ㅠ ㅠ ㅠ ㅠㅠ
862,262,__label__1,Wol Bulletin's Best
863,263,__label__1,Cheongnyangni fan signing Dio Why are you surprised?
864,264,__label__1,Toothbrush with toothpaste
865,265,__label__1,Hungry black
866,266,__label__1,I want to hunch
867,267,__label__1,Are you alive
868,268,__label__1,"No yah, really"
869,269,__label__1,An unfortunate day
870,270,__label__1,"Do not do anything in our mini-dressed dreams that are candy-free,"
871,271,__label__1,It is a mouse that has been pushed into the corner of the earth and can not be a friend who is not Bourinho slave.
872,272,__label__1,Real brothers and sisters.
873,273,__label__1,It's a miracle.
874,274,__label__1,Whisen Hoengseong Whirling Dance Whirling Dance
875,275,__label__1,Yunho's brother is out of the way. Homme Fatale
876,276,__label__1,I'm cold and hungry and sleepy
877,277,__label__1,"I do not know if it's been announced before, but I would have liked to tell you that Freddie was alive from the beginning to a few places."
878,278,__label__1,"No, I do not know why Laiwuing just did yesterday. I want to call Young Forever."
879,279,__label__1,"I do not want to see the stage myself, but when I look at the pictures, it looks really cool today too. ㅠ ㅠ ㅠ ㅠ ㅠ ㅠ ㅠ ㅠ ㅠ ㅠ ㅠ ㅠㅠ"
880,280,__label__1,Good job.
881,281,__label__1,"I am sorry that I am sorry about my head. ㅋ ㅋ ㅋ ㅋ ㅋ ㅋ Oh, I am just so embarrassed now. I do not know what to say because I am so tired. I do not think I can follow the beauty and character of Hwa Sui Jama."
882,282,__label__1,"I do not know where you live, but if you can draw someone named Winter"
883,283,__label__1,It went well and was dragon
884,284,__label__1,Do not let your sister go too far.
885,285,__label__1,"Chanel Cushion Refill I do not have to pay for my lake, but I'm waiting indefinitely,"
886,286,__label__1,I'm going to have to go to bed. I'm going to go to bed.
887,287,__label__1,And I really want to see a lot. I wonder how strong your brother is. I can not see you. It looks like a week a month. It's hard.
888,288,__label__1,I have not seen it yet.
889,289,__label__1,I do not know why you're all out of John except me.
890,290,__label__1,I can do it.
891,291,__label__1,Cheongnyangri fan signing RUNA ㅠ ㅠ ㅠ ㅠ ㅠ ㅠ ㅠ ㅠ ㅠ ㅠ ㅠ ㅠ ㅠ ㅠ ㅠ ㅠ ㅠ ㅠ ㅠ ㅠ ㅠ ㅠ ㅠ ㅠ ㅠ ㅠ ㅠ ㅠ ㅠ ㅠ ㅠ ㅠ ㅠ ㅠ ㅠ ㅠ ㅠ ㅠ ㅠ ㅠ ㅠ ㅠ ㅜ?
892,292,__label__1,Hot pretty cottons Photo Gifts Thank you Sumsom is a happy day too
893,293,__label__1,"Thank you, sir. Thank you very much. I have had a very pleasant and enjoyable day. Besides, thanks to you, it will be filled with good things today. I hope you have a happy day."
894,294,__label__1,I'm soooooooooooooooooooooah
895,295,__label__1,"Please support me to pass the entrance exam tomorrow. When the test is over, I will go to the big bang. I love big bang."
896,296,__label__1,If you pull
897,297,__label__1,"IPhone camera, I will keep quiet"
898,298,__label__1,Heck or not
899,299,__label__1,Thank you very much.
